Topics,Top_20_Words
0,rxjs oper catch throw import modul interceptor catcherror queue defin statement propag intern spinner nestj captur throttletim weird caught lettabl
1,observ switchmap forkjoin fail differ sourc connect rxjs remov websocket hot build resubscrib direct eventemitt jest manipul extern multicast schedulersio
2,observ type properti typescript exist proper assign argument requir miss void infer unknown length common operatorfunct equal generic angular he
3,angular map merg behaviorsubject load check rxjs user detect takeuntil sort scan version httpinterceptor topromis static mous redirect observablesubscrib chunk
4,rxjava retrofit handl combin custom listen realm consum wrap delet approach rxbind rxandroidbl couchbas observ li cha comb flowabletransformers rxjs
5,rxjava singl flowabl rxandroid send collect post fire queri pattern applic practic count current program spring pagin default notifi usag
6,emit item rxjs implement previous process access mergemap concatmap tap period fromev distinctuntilchang materi marbl support accumul autocomplet downstream pipelin
7,stream rxjs observ convert paramet concat httpclient swift infinit duplic reduc simpl invalid scroll match observablecr notif take behaviorrelay closur
8,array object filter condit repeat null string continu output generat boolean true split throttl fals size met race behav concaten
9,rxjava code trigger depend asynchron mock publishsubject publish javascript project limit backpressur behaviour local replay occur produc inject provid window
10,request http respons cancel cach parallel refresh poll token generic status header endpoint browser compositedispos intercept transact expand refcount publishreplay
11,angular updat interv correct app ionic rest replaysubject reset memori reactivex client push leak close httpget extract row migrat refactor
12,angular async pipe undefin read display templat render ngfor ngif sync export safe nodemodul asyncpip serv ject angulartour hero re
13,rx wait execut thread java issu react finish schedul emiss ui task background switch main flow subscribeon extens js express
14,subject valu rxjs element input buffer avoid timeout debounc behavior activ equival progress behavioursubject nodej caus sharereplay download altern dom
15,observ complet delay combinelatest zip perform run sequenti compos forc deprec outer track testschedul signal choos rxjs rxjava angular concaten
16,error retri add expect retrywhen rout initi prevent understand success guard cold upgrad compil navig angular observ cast incorrect path
17,observ creat unsubscrib sequenc except timer dispos start final paus html manual resum destroy effici throwerror rxjs characteristicexcept angular rxjava
18,api angular chang reactiv click form block button valid search debouncetim io url text valuechang key router login automat popul
19,function observ flatmap set loop share onerror oncomplet synchron appli ad modifi option refer withlatestfrom param unexpect lambda thrown deal
20,rxjs subscript promis resolv transform await separ symbol asobserv reconnect observ ersmainthread angular rxjava behav expand restart style throttl throwerror
21,servic compon test variabl unit time class dynam typeerror write retriev firestor groupbi recurs handler jasmin communic global ngoninit lazi
22,data ngrx action server reduxobserv databas epic redux dispatch ajax effect insert tabl web save db pars context distinct complex
23,rxjava android list kotlin store select specif rxkotlin replac selector logic interfac livedata recyclerview adapt asynctask coroutin reactor compar clean
24,rxswift call chain bind view network control model mvvm crash viewmodel tableview imag cell break upload reload rxcocoa architectur moya
25,subscrib event callback json onnext file unabl messag skip ignor concurr rxobserv origin ensur resourc emitt serial individu futur micronaut
26,return method observ nest receiv invok librari vertx flatten termin defer canactiv declar calcul page solv scenario design junit integr
27,multipl result pass base fetch firebas iter field child observ parent angularfir manag join instanc foreach content document addit subsequ
