Topics,Top_20_Words
0,angular event unsubscrib loop timer form rout user select interceptor ajax templat valid reset current httpget navig router row inject
1,observ retrofit wait pass base set finish dynam null listen messag guard url true param separ content fals fragment adapt
2,rxjs subject input share buffer behavior import connect detect tap websocket equival queue consum debouncetim limit count scan vertx throttl
3,request http updat result ngrx action rxjs cancel store httpclient prevent redux poll dispatch effect retriev reduc understand success selector
4,observ array object list valu merg convert promis element paramet transform iter sort push requir extract document provid distinct addit
5,data function test execut load unit sequenc except react check throw repeat refresh token write mock applic tabl jasmin local
6,rxjava rx condit java retri rxandroid proper zip process onnext app asynchron parallel timeout onerror modul ionic remov observ rest
7,multipl rxswift combin singl sourc send time previous server collect sequenti fetch button queri firebas databas rxjava model firestor join
8,oper stream rxjs pipe chang delay trigger interv differ click debounc reduxobserv retrywhen epic emiss receiv output takeuntil catcherror duplic
9,angular method servic compon custom add json network catch observ post unabl display rxjs child mvvm rxjava final parent simpl
10,rxjava android call chain api flatmap flowabl fail perform continu start oncomplet concatmap publish paus db flatten asynctask reactor resum
11,type map properti observ typescript switchmap implement undefin forkjoin kotlin exist assign expect read string concat argument specif typeerror boolean
12,return observ async item filter correct bind view access swift activ control field pattern invok search javascript ad await viewmodel
13,subscript complet creat observ behaviorsubject rxjs callback depend resolv dispos rxkotlin task replac hot insert skip project groupbi switch angularfir
14,subscrib emit observ nest variabl combinelatest rxjs cach avoid file mergemap fire initi synchron infinit publishsubject build generat recurs modifi
15,error handl respons thread code reactiv issu class run block schedul rxjava ui realm background practic io main crash subscribeon
